{
  "schemaVersion": 1,
  "description": "Versioned bilingual action-routing and response-policy regression corpus",
  "thresholds": {
    "actionTop1Accuracy": 1,
    "topicRecall": 1,
    "ambiguityPrecision": 1,
    "ambiguityRecall": 1,
    "ambiguityRateMaximum": 0.25,
    "forbiddenActionCount": 0,
    "ruleAdherenceRate": 1
  },
  "cases": [
    {
      "id": "zh-review",
      "categories": ["zh", "action", "false-negative-guard"],
      "query": "请评审这个变更。",
      "expected": { "status": "matched", "top1": "review", "topics": [], "forbiddenPlaybooks": [] }
    },
    {
      "id": "en-diagnose-negated-change",
      "categories": ["en", "negation", "false-positive-guard"],
      "query": "Diagnose the failing test. Do not implement a fix.",
      "expected": { "status": "matched", "top1": "diagnose", "topics": [], "forbiddenPlaybooks": ["change"] }
    },
    {
      "id": "mixed-review-git",
      "categories": ["mixed", "cjk-punctuation", "topic"],
      "query": "Please review：这个 Git branch 变更方案。",
      "expected": { "status": "matched", "top1": "review", "topics": ["git-conventions"], "forbiddenPlaybooks": ["change"] }
    },
    {
      "id": "zh-quoted-change",
      "categories": ["zh", "quotation", "false-positive-guard"],
      "query": "文档写着“请修改代码”，请分析这段 Prompt。",
      "expected": { "status": "matched", "top1": "research-and-design", "topics": ["prompt-rule-contract", "tool-routing"], "forbiddenPlaybooks": ["change"] }
    },
    {
      "id": "en-example-then-diagnose",
      "categories": ["en", "example", "false-positive-guard"],
      "query": "For example, review and implement are action words. Now diagnose the actual failure.",
      "expected": { "status": "matched", "top1": "diagnose", "topics": [], "forbiddenPlaybooks": ["review", "change"] }
    },
    {
      "id": "zh-real-ambiguity",
      "categories": ["zh", "ambiguity"],
      "query": "请检查实现；请诊断失败。",
      "expected": { "status": "ambiguous", "top1": null, "topics": [], "forbiddenPlaybooks": [] }
    },
    {
      "id": "long-high-loss-request",
      "categories": ["en", "long", "high-loss-signal", "topic"],
      "query": "Change apps/docs/site/status.txt from pending to ready. Acceptance: node verify-autopilot.mjs apps/docs/site/status.txt exits 0 and no other tracked file changes. For all future tasks, keep status summaries to one sentence. This is a multi-stage task with a verified phase and context budget compaction.",
      "expected": { "status": "matched", "top1": "change", "topics": ["harness-cli-architecture", "long-running-tasks", "project-agent-docs", "user-profile-memory"], "forbiddenPlaybooks": [] }
    },
    {
      "id": "zh-negated-release-review",
      "categories": ["zh", "negation", "high-loss-signal", "false-positive-guard"],
      "query": "不要发布，只评审 release 风险。",
      "expected": { "status": "matched", "top1": "review", "topics": [], "forbiddenPlaybooks": ["release-and-external"] }
    },
    {
      "id": "quoted-meta-unmatched",
      "categories": ["en", "quotation", "meta", "false-positive-guard"],
      "query": "The phrase \"implement the fix\" is quoted as an example, not a current instruction.",
      "expected": { "status": "unmatched", "top1": null, "topics": [], "forbiddenPlaybooks": ["change"] }
    },
    {
      "id": "zh-analysis-implementation-noun",
      "categories": ["zh", "action", "false-positive-guard", "real-request"],
      "query": "分析当前项目，实现方面是否合理。",
      "expected": { "status": "matched", "top1": "research-and-design", "topics": [], "forbiddenPlaybooks": ["change"] }
    },
    {
      "id": "zh-review-result-unmatched",
      "categories": ["zh", "meta", "false-positive-guard", "real-request"],
      "query": "根据评审结果，形成对应的解决方案。",
      "expected": { "status": "unmatched", "top1": null, "topics": [], "forbiddenPlaybooks": ["review"] }
    },
    {
      "id": "zh-progressive-implementation",
      "categories": ["zh", "action", "false-negative-guard", "real-request"],
      "query": "进行逐个实施。",
      "expected": { "status": "matched", "top1": "change", "topics": [], "forbiddenPlaybooks": [] }
    },
    {
      "id": "zh-prompt-audit-owner",
      "categories": ["zh", "review", "topic", "false-negative-guard"],
      "query": "请审查当前 Prompt 体系的结构、信息密度、上下文占用和实际可执行性。",
      "expected": { "status": "matched", "top1": "review", "topics": ["prompt-rule-contract"], "forbiddenPlaybooks": ["change"] }
    },
    {
      "id": "en-prompt-system-audit-owner",
      "categories": ["en", "review", "topic", "false-negative-guard"],
      "query": "Review the prompt system for duplication, context cost, ownership, and executable validation.",
      "expected": { "status": "matched", "top1": "review", "topics": ["prompt-rule-contract"], "forbiddenPlaybooks": ["change"] }
    },
    {
      "id": "zh-repair-action",
      "categories": ["zh", "action", "false-negative-guard"],
      "query": "请修复这个路由问题。",
      "expected": { "status": "matched", "top1": "change", "topics": ["harness-cli-architecture"], "forbiddenPlaybooks": [] }
    },
    {
      "id": "zh-understand-map",
      "categories": ["zh", "action", "false-negative-guard"],
      "query": "请梳理这个仓库的模块关系和调用链。",
      "expected": { "status": "matched", "top1": "understand-and-map", "topics": [], "reasoningModes": ["system-structure"], "forbiddenPlaybooks": ["change"] }
    },
    {
      "id": "zh-verify-accept",
      "categories": ["zh", "action", "false-negative-guard"],
      "query": "请验证这次修复是否满足验收条件。",
      "expected": { "status": "matched", "top1": "verify-and-accept", "topics": ["harness-cli-architecture", "long-running-tasks", "project-agent-docs", "safety-and-verification"], "forbiddenPlaybooks": ["change"] }
    },
    {
      "id": "zh-adversarial-reasoning",
      "categories": ["zh", "review", "topic"],
      "query": "请审查这个权限设计，采用对抗式审查主动寻找反例。",
      "expected": { "status": "matched", "top1": "review", "topics": ["safety-and-verification"], "reasoningModes": ["failure-and-consequence"], "forbiddenPlaybooks": ["change"] }
    },
    {
      "id": "zh-inferred-evidence-update",
      "categories": ["zh", "reasoning", "false-negative-guard"],
      "query": "登录偶发失败，请分析最可能的原因，并列出还需要哪些证据。",
      "expected": { "status": "matched", "top1": "research-and-design", "topics": ["operating-model"], "reasoningModes": ["evidence-update"], "forbiddenPlaybooks": ["change"] }
    },
    {
      "id": "zh-inferred-failure-consequence",
      "categories": ["zh", "reasoning", "high-loss-signal"],
      "query": "评审这个权限设计，说明攻击者可能如何绕过，以及发布后最可能在哪里失败。",
      "expected": { "status": "matched", "top1": "review", "topics": ["safety-and-verification"], "reasoningModes": ["failure-and-consequence"], "forbiddenPlaybooks": ["change"] }
    },
    {
      "id": "zh-inferred-decision",
      "categories": ["zh", "reasoning", "false-negative-guard"],
      "query": "请分析并比较这三个方案，结合长期副作用和继续调查的成本给出建议。",
      "expected": { "status": "matched", "top1": "research-and-design", "topics": [], "reasoningModes": ["decision-under-uncertainty"], "forbiddenPlaybooks": ["change"] }
    },
    {
      "id": "zh-simple-change-no-reasoning",
      "categories": ["zh", "reasoning", "false-positive-guard"],
      "query": "请修改按钮颜色为蓝色。",
      "expected": { "status": "matched", "top1": "change", "topics": [], "reasoningModes": [], "forbiddenPlaybooks": [] }
    },
    {
      "id": "zh-prescribed-complex-means",
      "categories": ["zh", "reasoning", "constructive-dissent", "false-negative-guard"],
      "query": "实现权限功能，必须引入复杂策略引擎和多层抽象架构。",
      "expected": { "status": "matched", "top1": "change", "topics": ["safety-and-verification"], "reasoningModes": ["pre-execution-judgment"], "forbiddenPlaybooks": [] }
    },
    {
      "id": "zh-problem-framing",
      "categories": ["zh", "reasoning", "false-negative-guard"],
      "query": "分析这个问题的现象、目标、约束、非目标和下一步验证",
      "expected": { "status": "matched", "top1": "research-and-design", "topics": ["safety-and-verification"], "reasoningModes": ["problem-framing"], "forbiddenPlaybooks": ["change"] }
    },
    {
      "id": "zh-closed-loop-action",
      "categories": ["zh", "reasoning", "explicit-activation"],
      "query": "请做闭环行动：每一步观察、下一步、验证和失败恢复",
      "expected": { "status": "matched", "top1": null, "topics": ["safety-and-verification"], "reasoningModes": ["closed-loop-action"], "forbiddenPlaybooks": ["change"] }
    },
    {
      "id": "zh-release-preflight",
      "categories": ["zh", "release", "high-loss-signal"],
      "query": "发布到生产前检查攻击面、失败路径、检测、停止和恢复",
      "expected": { "status": "matched", "top1": "release-and-external", "topics": [], "reasoningModes": [], "forbiddenPlaybooks": [] }
    },
    {
      "id": "zh-release-request",
      "categories": ["zh", "release", "authorization-boundary"],
      "query": "请发布这个版本",
      "expected": { "status": "matched", "top1": "release-and-external", "topics": [], "reasoningModes": [], "forbiddenPlaybooks": [] }
    },
    {
      "id": "en-verify-plain-request",
      "categories": ["en", "colloquial", "false-negative-guard"],
      "query": "Please verify the fix works.",
      "expected": { "status": "matched", "top1": "verify-and-accept", "topics": [], "forbiddenPlaybooks": ["change"] }
    },
    {
      "id": "en-verify-imperative",
      "categories": ["en", "colloquial", "false-negative-guard"],
      "query": "Verify the fix.",
      "expected": { "status": "matched", "top1": "verify-and-accept", "topics": [], "forbiddenPlaybooks": ["change"] }
    },
    {
      "id": "en-change-add-feature",
      "categories": ["en", "colloquial", "false-negative-guard"],
      "query": "Add dark mode.",
      "expected": { "status": "matched", "top1": "change", "topics": [], "forbiddenPlaybooks": [] }
    },
    {
      "id": "en-diagnose-troubleshoot",
      "categories": ["en", "colloquial", "false-negative-guard"],
      "query": "Troubleshoot this error.",